{
  "schema_version": "as1.v1.4",
  "satellite_id": "AS1",
  "platform": "TRADINGVIEW",
  "layout_id": "MAAT",
  "observer": "MAAT",
  "code_version": "MAAT_STOPWATCH_AS1_V1_4",
  "source_profile_code": "CB_BTCUSD_SPOT_20260722_V1",
  "instrument": {
    "ticker_id": "COINBASE:BTCUSD",
    "venue": "COINBASE",
    "symbol": "BTCUSD",
    "base_asset": "BTC",
    "quote_asset": "USD",
    "asset_class": "CRYPTO",
    "instrument_type": "SPOT",
    "contract": {
      "contract_type": "NONE",
      "contract_id": null,
      "series_symbol": null,
      "expiry_kind": "NONE",
      "expiry_time": null,
      "settlement_asset": "USD",
      "contract_multiplier": null,
      "continuous_series": false,
      "adjustment_mode": "NONE",
      "adjustment_applied": false,
      "roll_state": "NONE",
      "roll_event": false
    },
    "extensions": {"feed": "design-example"}
  },
  "session_hint": {"session_type": "CONTINUOUS_24_7", "session_state": "OPEN", "is_market_open": true},
  "timing": {"timeframe": "240", "bar_open_time": 1785131100000, "bar_close_time": 1785145500000, "sent_at": 1785145501000},
  "bar": {"open": 100000, "high": 100250, "low": 99850, "close": 100100, "volume": 123.45, "volume_unit": "BASE_ASSET", "volume_basis": "EXCHANGE_NATIVE"},
  "packet_type": "VALIDATION_SNAPSHOT",
  "confirmed": true,
  "quality": {"sensor_quality": "GOOD", "valid": true, "flags": []},
  "client_event_key": "AS1|MAAT|VALIDATION_SNAPSHOT|COINBASE:BTCUSD|240|1785145500000|as1.v1.4",
  "payload": {
    "contract_version": "maat.validation.v1",
    "record_status": "WATCH",
    "validation_outcome": "PENDING",
    "automatic_hit_miss": "SUPPRESSED",
    "aggregate": {
      "state_code": 5,
      "score": 63.2,
      "risk_code": 1,
      "event_code": 0,
      "sync_count": 4,
      "conflict_count": 1,
      "lie_score": 18.5,
      "lie_code": 0,
      "why_code": 9,
      "direction_state_code": 1,
      "direction_semantics": "OBSERVED_SENSOR_STATE_NOT_PREDICTION"
    },
    "sensors": {
      "rpc": {"linked": true, "valid": true, "direction_state_code": 1, "score": 61, "risk_code": 1, "event_code": 0},
      "structure": {"linked": true, "valid": true, "direction_state_code": 1, "score": 68, "risk_code": 1, "event_code": 1},
      "volume": {"linked": true, "valid": true, "direction_state_code": 0, "score": 55, "risk_code": 1, "event_code": 0},
      "heru": {"linked": true, "valid": true, "direction_state_code": 1, "score": 66, "risk_code": 0, "event_code": 0},
      "wenut": {"linked": true, "valid": true, "direction_state_code": 0, "score": 59, "risk_code": 1, "event_code": 0},
      "rsi": {"linked": true, "valid": true, "direction_state_code": 1, "score": 70, "risk_code": 1, "event_code": 0}
    },
    "stopwatch": {
      "phase": "COUNTDOWN_GATE",
      "main_tf_minutes": 240,
      "parent_tf_minutes": 480,
      "target_time": 1785159900000,
      "window_start": 1785158700000,
      "window_end": 1785161100000,
      "remaining_minutes": 240,
      "in_window": false,
      "noise_score": 21,
      "volume_event_observed": false,
      "volume_type": "-",
      "rvol": 1.12
    }
  }
}
